{
  "$schema": "./schema.json",
  "network": "rhc-mainnet-v3",
  "chainId": 4663,
  "status": "superseded",
  "dev": true,
  "rpc": "https://rpc.mainnet.chain.robinhood.com",
  "explorer": "https://robinhoodchain.blockscout.com",
  "settlementAsset": "0x5fc5360D0400a0Fd4f2af552ADD042D716F1d168",
  "settlementDecimals": 6,
  "supersedes": "rhc-mainnet-v2",
  "deployer": "0x6B6fC40Ed9652728A9B620C4e1B05fBF4F9712a4",
  "note": "Third contract set on Robinhood Chain mainnet, planned, with a one-hour timelock. BRSR and Vesting carry over from rhc-mainnet-token and the Poseidon libraries from rhc-mainnet-v2; every other contract will be new. Each deploy script writes its own section as it runs, and the status turns live when the last migration step retires the records this one replaces.",
  "external": {
    "PoolManager": "0x8366a39CC670B4001A1121B8F6A443A643e40951",
    "StateView": "0xF3334192D15450CdD385c8B70e03f9A6bD9E673b",
    "AccessRegistry": "0xe10b6f6B275de231345c20D14Ab812db62151b00",
    "PoseidonT3": "0xf967B532757ae8DfE2F9a82F956fE04730A666bA",
    "PoseidonT4": "0xD483B2384ed0DC1395dEb401b673f8d36362757b",
    "assets": {
      "SGOV": {
        "address": "0x92FD66527192E3e61d4DDd13322Aa222DE86F9B5",
        "feed": "0xa0DF4ee0fFf975306345875E3548Fcc519577A11",
        "kind": "treasury",
        "poolId": "0x2a72510d7d92cc121f9733ab6d14227ef8963cfadf9d40ac574f02e20e6299a8"
      },
      "SPY": {
        "address": "0x117cc2133c37B721F49dE2A7a74833232B3B4C0C",
        "feed": "0x319724394D3A0e3669269846abE664Cd621f9f6A",
        "kind": "stock",
        "poolId": "0xe5923c8a8be481ec89a2ca784a2bbfa4235de6d88f92260fd66b660c4babf907"
      },
      "NVDA": {
        "address": "0xd0601CE157Db5bdC3162BbaC2a2C8aF5320D9EEC",
        "feed": "0x379EC4f7C378F34a1B47E4F3cbeBCbAC3E8E9F15",
        "kind": "stock",
        "poolId": "0x6444a8e0b267406a15db74ca00c4a24bdfa81ed3180f5b6d0851f8ed6f4f29c5"
      },
      "AAPL": {
        "address": "0xaF3D76f1834A1d425780943C99Ea8A608f8a93f9",
        "feed": "0x6B22A786bAa607d76728168703a39Ea9C99f2cD0",
        "kind": "stock",
        "poolId": "0xc748f4671a867db48b552f6b7650bf3255e05f80f00e3f7aad1b17ccb7898fdb"
      }
    }
  },
  "roles": {
    "timelockSigners": [
      "0xb51c63568324848DfC88A09f91F06fA86771aB69",
      "0x3C7facc7C72c3aCeB2EF93703813652aC9039266",
      "0x1f3eE000728EF363B9F867f88BBF618F2A17c42d"
    ],
    "guardian": "0x7cfF32B8B4DB47E2Cde5907c8F5c93EC6a095E2A",
    "treasury": "0x7f2D3be9597fb538BDBA3Dbcb9BEcECCD9056d21",
    "slashSink": "0xb4A7D77a710f6b1fF4cDDd9D3c9b66E3f917A4FF",
    "liquidity": "0x0DF776dBD1Ce5A8F38993Bc98bc3D81661FA51B2",
    "resolvers": [
      "0xD8D90e4c8f3419B1b8305dF2905eb31d3fBBf599",
      "0xC284CdA6c6982447f202830f4e969F13cBcB0b94",
      "0x7062A480732EC7B0F00a3D0c968356e1671dd356"
    ]
  },
  "contracts": {
    "AdminTimelock": "0xD91A6577828424E386900D0bB41596c6eF3BF8DF",
    "Reputation": "0xF2510fB02BaE866fD307CE5f48BBe1B1C2E17238",
    "Escrow": "0x68D4aD683b5519C785Dde9F0ee0eE09dB2D40919",
    "OracleRegistry": "0x20E75139996fFf7B3158DF28Bf133b326DCD2BdF",
    "AgentRegistry": "0xCa7b01237a43a515FbFBB5BA3e0Fed7e953139c9",
    "MandateAccountFactory": "0x946FFE695eCc8Ceb201Cf3Dd07dBd302e289Fd07"
  },
  "token": {
    "BRSR": "0x00e503925880c4b07E5Fb70232D83aD871F57a7d",
    "Vesting": "0x5aD3d29C80C1617F3B195d74D593Bc9839681b2F",
    "Staking": "0x31CbD06003089B00897F0d7e3c283C66a1768d9A",
    "Buyback": "0x51a88fb749738CB31ddb1F35A426ab2189F45eab",
    "V4LiquiditySeeder": "0x2cD0c0f114A4E7A20EF7967355E0986D0F82e125",
    "keeper": "0xD8D90e4c8f3419B1b8305dF2905eb31d3fBBf599",
    "poolId": "0x95bdade638ae86f8f1e424a2561796dd3aea34d75f594bd03cdb8d9e615ec765",
    "fromBlock": 26089853
  },
  "verifiedOnChain": {},
  "fromBlock": 26089848,
  "parameters": {
    "AdminTimelock": {
      "timelockPeriod": 3600
    },
    "Escrow": {
      "feeBps": 100,
      "resolverFeeBps": 50,
      "disputeBondBps": 500,
      "minTtl": 300,
      "maxTtl": 604800,
      "disputeWindow": 3600,
      "minLock": "10000"
    },
    "Reputation": {
      "baseCap": "25000000",
      "capPerScore": "2250000",
      "maxCap": "250000000"
    },
    "OracleRegistry": {
      "commitWindow": 3600,
      "revealWindow": 3600,
      "unbondingPeriod": 604800,
      "quorum": 2,
      "maxVoters": 64,
      "maxDeviation": 20,
      "slashBps": 1000
    },
    "AgentRegistry": {
      "minStake": "5000000",
      "slashBps": 1000
    },
    "Staking": {
      "unbondingPeriod": 604800,
      "minBond": "1000000000000000000000000000",
      "resolverBondFloor": "30000000000000000000000"
    },
    "Buyback": {
      "spendPerCall": "500000",
      "maxSpendPerWindow": "5000000",
      "minSpend": "100000",
      "maxPriceMicroUsdPerBrsr": "240",
      "window": 86400,
      "minInterval": 3600,
      "poolFee": 3000,
      "poolTickSpacing": 60,
      "poolHooks": "0x0000000000000000000000000000000000000000"
    },
    "CreditPool": {
      "totalDebtCap": "100000000",
      "perMandateCap": "10000000",
      "baseRateBps": 200,
      "slopeBps": 1800
    },
    "CollateralVault": {
      "minBorrowHealth": "1250000000000000000",
      "liquidationTarget": "1050000000000000000",
      "bountyBps": 500
    },
    "CommittedMandateFactory": {
      "ceiling": "25000000"
    }
  },
  "rwa": {
    "AssetRegistry": "0x91BbeFa8d36aFE097D7579053efEd2EA7ebb6F0E",
    "PriceGuard": "0xEcCDd1cBb5474cBe98f3038A864182F2766dFd8b",
    "StockSpendRouter": "0x6419E4aD018ca61775C4dc98AdfcB214425F43B4",
    "TreasuryPark": "0x2c49571a26bb090BAEa3D295B64D7230287e7459",
    "assets": {
      "SGOV": {
        "address": "0x92FD66527192E3e61d4DDd13322Aa222DE86F9B5",
        "feed": "0xa0DF4ee0fFf975306345875E3548Fcc519577A11",
        "kind": "treasury"
      },
      "SPY": {
        "address": "0x117cc2133c37B721F49dE2A7a74833232B3B4C0C",
        "feed": "0x319724394D3A0e3669269846abE664Cd621f9f6A",
        "kind": "stock"
      },
      "NVDA": {
        "address": "0xd0601CE157Db5bdC3162BbaC2a2C8aF5320D9EEC",
        "feed": "0x379EC4f7C378F34a1B47E4F3cbeBCbAC3E8E9F15",
        "kind": "stock"
      },
      "AAPL": {
        "address": "0xaF3D76f1834A1d425780943C99Ea8A608f8a93f9",
        "feed": "0x6B22A786bAa607d76728168703a39Ea9C99f2cD0",
        "kind": "stock"
      }
    },
    "adapters": {
      "SGOV": "0xF757F9c79d4C737Eb6D132c43527949B58Ce5fBA",
      "USDG": "0x8c824083F77d7d8A57d5Ca4fA9554b4688a7793d"
    },
    "fromBlock": 26089856,
    "collateral": {
      "CreditPool": "0x60736a2395F3333BB7f822CaBE5ed893F85AA15D",
      "CollateralVault": "0xc1F22f29cB72d5b5CC58277E5F9c2EC2BC311b6C",
      "Staking": "0x31CbD06003089B00897F0d7e3c283C66a1768d9A",
      "lender": "0x6B6fC40Ed9652728A9B620C4e1B05fBF4F9712a4",
      "fromBlock": 26089861
    }
  },
  "privacy": {
    "WithinMandateVerifier": "0x26B780AfF35Db0C371A2c33B8E48AA1c61962Ac3",
    "CommittedMandateFactory": "0xBF48A1e16203401432caE992F3355A4Cc3a0D9cd",
    "DisclosureRegistry": "0x3F805111312Eed1076278f515D3fD2cA9370345a",
    "SolvencyLog": "0x21811Ce7994fB6E49D71502b8ad13c22771B1aF3",
    "solvencyPoster": "0x6B6fC40Ed9652728A9B620C4e1B05fBF4F9712a4",
    "fromBlock": 26089863,
    "shielded": {
      "PoseidonT3": "0xf967B532757ae8DfE2F9a82F956fE04730A666bA",
      "PoseidonT4": "0xD483B2384ed0DC1395dEb401b673f8d36362757b",
      "WithdrawalVerifier": "0xD9869A7a4b8C878558D09aF705D9F81da0f864FE",
      "CommitmentVerifier": "0x0A36E95bAc3C354E27223c4033842Eec786690e3",
      "EntrypointImplementation": "0xe3d710744971B17bBC05228d66579338D4d0B12b",
      "Entrypoint": "0x8baf2B9fB7D779651c2Dfd59C71ba0D2de3135F0",
      "ShieldedPool": "0x91F91bD9584D5fB57e9d2761728452c95b7b11A4",
      "ShieldedRelay": "0xc82CdEba05915F65E58a975dFb01dC9FD9CEfECc",
      "AccessRegistry": "0xe10b6f6B275de231345c20D14Ab812db62151b00",
      "asset": "0x5fc5360D0400a0Fd4f2af552ADD042D716F1d168",
      "scope": "2404886527165639353443500877983435423007157874463436661676521647649117545010",
      "maxDeposit": "100000000",
      "maxTotal": "1000000000",
      "minimumDeposit": "1000000",
      "vettingFeeBps": 10,
      "maxRelayFeeBps": 500,
      "aspPostman": "0x731F3BbbD40ae5387646A62D5F08C2517aA84bbe",
      "relayer": "0xc8FB46218bA6750EBF8cE7Cc8f7a56D7C7F99630",
      "fromBlock": 26089867
    }
  },
  "exampleMandate": {
    "address": "0x4a373BFCc5bb36dc6cA10C407189c45eb40058E5",
    "principal": "0x877c349EFb5926082C413833E8055F0991185c61",
    "agent": "0x877c349EFb5926082C413833E8055F0991185c61",
    "factory": "0x946FFE695eCc8Ceb201Cf3Dd07dBd302e289Fd07",
    "salt": "0x2eaf23ef1068d7ab2de0d480c8177360eb423b35f2ab03349ecd5833ba5ff61e"
  },
  "exampleCollateralMandate": {
    "address": "0x6CE1bF2833C8790e7D63E988FA308727a04dFDDA",
    "principal": "0x877c349EFb5926082C413833E8055F0991185c61",
    "agent": "0x877c349EFb5926082C413833E8055F0991185c61",
    "factory": "0x946FFE695eCc8Ceb201Cf3Dd07dBd302e289Fd07",
    "salt": "0x28c9d1c55ce032e87125bb67b84d0abcf828d7259e41038dcb1d853598542fba"
  },
  "exampleCommittedMandate": {
    "address": "0x322b062E4B7989B9C80FCfeBed61A721Ebf3c633",
    "principal": "0x877c349EFb5926082C413833E8055F0991185c61",
    "agent": "0x877c349EFb5926082C413833E8055F0991185c61",
    "factory": "0xBF48A1e16203401432caE992F3355A4Cc3a0D9cd",
    "salt": "0x5499e3f19b86ebe4a39c131be4b058a395bda0fbefaa0dc0faa84a732ede8f10"
  },
  "supersededBy": "rhc-mainnet-v4"
}