{
  "$schema": "./schema.json",
  "network": "rhc-mainnet-v5",
  "chainId": 4663,
  "status": "planned",
  "dev": false,
  "rpc": "https://rpc.mainnet.chain.robinhood.com",
  "explorer": "https://robinhoodchain.blockscout.com",
  "settlementAsset": "0x5fc5360D0400a0Fd4f2af552ADD042D716F1d168",
  "settlementDecimals": 6,
  "supersedes": "rhc-mainnet-v4",
  "deployer": "0x6B6fC40Ed9652728A9B620C4e1B05fBF4F9712a4",
  "note": "Fifth contract set on Robinhood Chain mainnet, planned: the fourth set with its collateral lane rebuilt after the rescore. The price guard, the stock router, the treasury adapter, the credit pool and the collateral vault will be new; everything else carries over from rhc-mainnet-v4 at its addresses, with the 48-hour timelock as governance and the one-hour timelock as the escrow's pauser, as the fourth record reads once its governance handover has landed. Each deploy script writes its own section as it runs. The status turns live when the apps move to this set, and rhc-mainnet-v4 retires once nothing is open on its credit pool and collateral vault.",
  "external": {
    "PoolManager": "0x8366a39CC670B4001A1121B8F6A443A643e40951",
    "StateView": "0xF3334192D15450CdD385c8B70e03f9A6bD9E673b",
    "AccessRegistry": "0xe10b6f6B275de231345c20D14Ab812db62151b00",
    "PoseidonT3": "0xf967B532757ae8DfE2F9a82F956fE04730A666bA",
    "PoseidonT4": "0xD483B2384ed0DC1395dEb401b673f8d36362757b",
    "assets": {
      "SGOV": {
        "address": "0x92FD66527192E3e61d4DDd13322Aa222DE86F9B5",
        "feed": "0xa0DF4ee0fFf975306345875E3548Fcc519577A11",
        "kind": "treasury",
        "poolId": "0x2a72510d7d92cc121f9733ab6d14227ef8963cfadf9d40ac574f02e20e6299a8"
      },
      "SPY": {
        "address": "0x117cc2133c37B721F49dE2A7a74833232B3B4C0C",
        "feed": "0x319724394D3A0e3669269846abE664Cd621f9f6A",
        "kind": "stock",
        "poolId": "0xe5923c8a8be481ec89a2ca784a2bbfa4235de6d88f92260fd66b660c4babf907"
      },
      "NVDA": {
        "address": "0xd0601CE157Db5bdC3162BbaC2a2C8aF5320D9EEC",
        "feed": "0x379EC4f7C378F34a1B47E4F3cbeBCbAC3E8E9F15",
        "kind": "stock",
        "poolId": "0x6444a8e0b267406a15db74ca00c4a24bdfa81ed3180f5b6d0851f8ed6f4f29c5"
      },
      "AAPL": {
        "address": "0xaF3D76f1834A1d425780943C99Ea8A608f8a93f9",
        "feed": "0x6B22A786bAa607d76728168703a39Ea9C99f2cD0",
        "kind": "stock",
        "poolId": "0xc748f4671a867db48b552f6b7650bf3255e05f80f00e3f7aad1b17ccb7898fdb"
      }
    }
  },
  "roles": {
    "timelockSigners": [
      "0xb51c63568324848DfC88A09f91F06fA86771aB69",
      "0x3C7facc7C72c3aCeB2EF93703813652aC9039266",
      "0x1f3eE000728EF363B9F867f88BBF618F2A17c42d"
    ],
    "guardian": "0x7cfF32B8B4DB47E2Cde5907c8F5c93EC6a095E2A",
    "treasury": "0x7f2D3be9597fb538BDBA3Dbcb9BEcECCD9056d21",
    "slashSink": "0xb4A7D77a710f6b1fF4cDDd9D3c9b66E3f917A4FF",
    "liquidity": "0x0DF776dBD1Ce5A8F38993Bc98bc3D81661FA51B2",
    "resolvers": [
      "0xD8D90e4c8f3419B1b8305dF2905eb31d3fBBf599",
      "0xC284CdA6c6982447f202830f4e969F13cBcB0b94",
      "0x7062A480732EC7B0F00a3D0c968356e1671dd356"
    ]
  },
  "contracts": {
    "AdminTimelock": "0xffe874aA257C99414205ddf684903e30761E1832",
    "escrowPauser": "0xD91A6577828424E386900D0bB41596c6eF3BF8DF",
    "Reputation": "0x4FEa7af88C60988E80b065F6e2af071C7fB3F5E8",
    "Escrow": "0x11e73B5632837355e250fC236cFC2Be03aD0845A",
    "OracleRegistry": "0xbb628E362EceE9Ce16f2e48DD79f5ed4558596e3",
    "AgentRegistry": "0x6501ABAb6aF58549De0Dd42040240665591c6C2a",
    "MandateAccountFactory": "0xC42dBCbd34E64e2D81B48866F673ddB7B42ba562"
  },
  "token": {
    "BRSR": "0x00e503925880c4b07E5Fb70232D83aD871F57a7d",
    "Vesting": "0x5aD3d29C80C1617F3B195d74D593Bc9839681b2F",
    "Staking": "0x31CbD06003089B00897F0d7e3c283C66a1768d9A",
    "Buyback": "0x51a88fb749738CB31ddb1F35A426ab2189F45eab",
    "V4LiquiditySeeder": "0x2cD0c0f114A4E7A20EF7967355E0986D0F82e125",
    "keeper": "0xD8D90e4c8f3419B1b8305dF2905eb31d3fBBf599",
    "poolId": "0x95bdade638ae86f8f1e424a2561796dd3aea34d75f594bd03cdb8d9e615ec765",
    "fromBlock": 76462774
  },
  "governance48": {
    "AdminTimelock": "0xffe874aA257C99414205ddf684903e30761E1832",
    "signers": [
      "0xb51c63568324848DfC88A09f91F06fA86771aB69",
      "0x3C7facc7C72c3aCeB2EF93703813652aC9039266",
      "0x1f3eE000728EF363B9F867f88BBF618F2A17c42d"
    ],
    "guardian": "0x7cfF32B8B4DB47E2Cde5907c8F5c93EC6a095E2A",
    "timelockPeriod": 172800,
    "previous": "0xD91A6577828424E386900D0bB41596c6eF3BF8DF",
    "fromBlock": 78636336
  },
  "verifiedOnChain": {},
  "fromBlock": 77686776,
  "parameters": {
    "AdminTimelock": {
      "timelockPeriod": 172800
    },
    "Escrow": {
      "feeBps": 100,
      "resolverFeeBps": 50,
      "disputeBondBps": 500,
      "minTtl": 300,
      "maxTtl": 604800,
      "disputeWindow": 3600,
      "minLock": "10000"
    },
    "Reputation": {
      "baseCap": "25000000",
      "capPerScore": "2250000",
      "maxCap": "250000000",
      "minScored": "1000000",
      "edgeCap": "62500000",
      "fullCredit": "250000000"
    },
    "OracleRegistry": {
      "commitWindow": 3600,
      "revealWindow": 3600,
      "unbondingPeriod": 604800,
      "quorum": 2,
      "maxVoters": 64,
      "maxDeviation": 20,
      "slashBps": 1000
    },
    "AgentRegistry": {
      "minStake": "5000000",
      "slashBps": 1000
    },
    "Staking": {
      "unbondingPeriod": 604800,
      "minBond": "1000000000000000000000000000",
      "resolverBondFloor": "30000000000000000000000"
    },
    "Buyback": {
      "spendPerCall": "500000",
      "maxSpendPerWindow": "5000000",
      "minSpend": "100000",
      "maxPriceMicroUsdPerBrsr": "240",
      "window": 86400,
      "minInterval": 3600,
      "poolFee": 3000,
      "poolTickSpacing": 60,
      "poolHooks": "0x0000000000000000000000000000000000000000"
    },
    "CommittedMandateFactory": {
      "ceiling": "25000000"
    }
  },
  "rwa": {
    "AssetRegistry": "0xbd4950505d45e53740DA4941B666B3C796818393",
    "TreasuryPark": "0xfE7419caAd0181f77F850ae5D1c70bFd16Ef118f",
    "assets": {
      "SGOV": {
        "address": "0x92FD66527192E3e61d4DDd13322Aa222DE86F9B5",
        "feed": "0xa0DF4ee0fFf975306345875E3548Fcc519577A11",
        "kind": "treasury"
      },
      "SPY": {
        "address": "0x117cc2133c37B721F49dE2A7a74833232B3B4C0C",
        "feed": "0x319724394D3A0e3669269846abE664Cd621f9f6A",
        "kind": "stock"
      },
      "NVDA": {
        "address": "0xd0601CE157Db5bdC3162BbaC2a2C8aF5320D9EEC",
        "feed": "0x379EC4f7C378F34a1B47E4F3cbeBCbAC3E8E9F15",
        "kind": "stock"
      },
      "AAPL": {
        "address": "0xaF3D76f1834A1d425780943C99Ea8A608f8a93f9",
        "feed": "0x6B22A786bAa607d76728168703a39Ea9C99f2cD0",
        "kind": "stock"
      }
    },
    "adapters": {
      "USDG": "0xC92F0275717CaB35CD5A501223bCEE042b4a5506"
    },
    "fromBlock": 77687902
  },
  "privacy": {
    "WithinMandateVerifier": "0xFF4b6B355c2A923fdf585BC4DaBec152D615B459",
    "CommittedMandateFactory": "0x227259542FE9C6b1F1899A94ec13d7A824A4B4EB",
    "DisclosureRegistry": "0x2C7B264f596302806d945f42DCF242A757188994",
    "SolvencyLog": "0x9B0131e101080A19Ef5D94b47B0a4BBD7e342020",
    "solvencyPoster": "0x6B6fC40Ed9652728A9B620C4e1B05fBF4F9712a4",
    "fromBlock": 77688972,
    "shielded": {
      "PoseidonT3": "0xf967B532757ae8DfE2F9a82F956fE04730A666bA",
      "PoseidonT4": "0xD483B2384ed0DC1395dEb401b673f8d36362757b",
      "WithdrawalVerifier": "0xE78C90A981036Db48Bd7a611974148d78417bBE0",
      "CommitmentVerifier": "0x888922cc4F2C1428f04788823D36511b6062F85b",
      "EntrypointImplementation": "0x20989ee637c7513428f9b1ca8020BE67c1D60f1d",
      "Entrypoint": "0x42DA6BE9eAf31A7b5051a0926ACB2e93E32991ee",
      "ShieldedPool": "0xdF48d94951d4944A15d73e33fCc695bAe6161256",
      "ShieldedRelay": "0x2aC40b3A95b4B88d0Fc774E503926ad96Fbed440",
      "AccessRegistry": "0xe10b6f6B275de231345c20D14Ab812db62151b00",
      "asset": "0x5fc5360D0400a0Fd4f2af552ADD042D716F1d168",
      "scope": "11316643497466844207784243260997288539593440902365347383061115370798862767815",
      "maxDeposit": "100000000",
      "maxTotal": "1000000000",
      "maxPerDepositor": "250000000",
      "depositorWindow": 604800,
      "minimumDeposit": "1000000",
      "vettingFeeBps": 10,
      "maxRelayFeeBps": 500,
      "aspPostman": "0x731F3BbbD40ae5387646A62D5F08C2517aA84bbe",
      "relayer": "0xc8FB46218bA6750EBF8cE7Cc8f7a56D7C7F99630",
      "fromBlock": 77689418
    }
  },
  "exampleMandate": {
    "address": "0x8605853aC6A64dA11F4ED0Ff0Ad128961Cc3cd5c",
    "principal": "0x877c349EFb5926082C413833E8055F0991185c61",
    "agent": "0x877c349EFb5926082C413833E8055F0991185c61",
    "factory": "0xC42dBCbd34E64e2D81B48866F673ddB7B42ba562",
    "salt": "0x93de9afadd9820c0722f5cb9bbfbb891313561717b89aa1ef6abdf21c3c303dc"
  },
  "exampleCommittedMandate": {
    "address": "0xc80D3D2C188faa94977824149CE7e63175B22F32",
    "principal": "0x877c349EFb5926082C413833E8055F0991185c61",
    "agent": "0x877c349EFb5926082C413833E8055F0991185c61",
    "factory": "0x227259542FE9C6b1F1899A94ec13d7A824A4B4EB",
    "salt": "0x9cbeffed8cf08137edb493d4214e613fd57061c322f5d5483fd900b33b75be5b"
  }
}
